query,cluster,group,demand,comp,category
печать самоклеящихся стикеров,печать наклеек на самоклеющейся бумаге,,383,,PRINT
печать шильдов,печать шильдиков,,164,,PRINT
наклейки на оборудование,наклейки на оборудование,,119,,PRINT
этикеточный принтер купить,принтер этикеток,,85,,PRINT
техническая этикетка,промышленные этикетки,,63,,PRINT
печать и резка наклеек,печать наклеек с контурной резкой,,28,,PRINT
оборудование для печати наклеек на самоклеющейся пленке,принтер этикеток,,27,,PRINT
принтер плоттер для печати наклеек,плоттер наклейки,,23,,PRINT
наклейка на оборудование,наклейки на оборудование,,18,,PRINT
плоттер для стикеров,плоттер наклейки,,17,,PRINT
шильды наклейки изготовление,изготовление шильд с гравировкой,,15,,PRINT
плоттер для стикеров и наклеек,плоттер наклейки,,15,,PRINT
изготовление наклеек на оборудование,наклейки на оборудование,,11,,PRINT
печать наклеек на оборудование,наклейки на оборудование,,11,,PRINT
плоттер для изготовления наклеек,плоттер наклейки,,11,,PRINT
изготовление наклеек на оборудование москва,наклейки на оборудование,,10,,PRINT
изготовление шильдов для оборудования,изготовление шильдиков,,9,,PRINT
купить плоттер для наклеек,плоттер наклейки,,7,,PRINT
оборудование для печати наклеек на самоклеющейся пленке с контурной резкой,плоттер наклейки,,5,,PRINT
наклейки на оборудование износостойкие,наклейки на оборудование,,3,,PRINT
самоклеющаяся этикетка с логотипом на заказ,этикетки на заказ,,3,,PRINT
3,наклейки на оборудование,,3,,PRINT
станок для печати наклеек на самоклеющейся пленке,плоттер наклейки,,2,,PRINT
оборудование для печати наклеек,принтер этикеток,,2,,PRINT
наклейки на шкаф электрический,наклейки на электрощиток,,1,,PRINT
наклейки для продукции,заказать наклейки с логотипом компании цена,,1,,PRINT
1,печать шильдиков,,1,,PRINT
наклейки на оборудование stickerwell,заказать наклейку на стекло stickerwell,,1,,BRANDED
оборудование для наклейки защитного стекла на телефон,приспособление для наклейки защитного стекла на телефон купить,,1,,PRINT
оборудование для изготовления наклеек на самоклеющейся пленке,плоттер наклейки,,1,,PRINT
наклейки на станки,наклейки на оборудование,,0,,PRINT
оборудование для производства наклеек и стикеров,плоттер наклейки,,0,,PRINT
производство наклеек на заказ для бизнеса,производство наклеек на заказ для бизнеса,,0,,PRINT
