query,cluster,group,demand,comp,category
обозначение сварки на чертежах по гост,обозначение сварных швов на чертежах,,99,,NONTARGET
кухонный топорик чертеж,кухонный топорик чертеж,,99,,PRINT
беседки чертежи и размеры схемы и проекты эскизы,беседка своими руками из дерева чертежи и размеры,,99,,PRINT
гост 21,гост р 21.101-2020,,98,,PRINT
обозначение шероховатости на чертеже по гост,гост 2.309,,97,,NONTARGET
оформление чертежей гост,гост р 21.101-2020,,96,,PRINT
шероховатость на чертеже гост,гост 2.309,,96,,PRINT
разбивочный чертеж,разбивочный чертеж,,96,,PRINT
четыре черненьких чумазеньких чертенка чертили черными чернилами чертеж,четыре чёрненьких чумазеньких чертёнка чертили чёрными чернилами чертёж,,96,,PRINT
алюминиевый кронштейн,кронштейн для алюминиевого фасадного профиля,,96,,PRINT
рамка основной надписи на чертеже выполняется какой линией,рамка чертежа,,95,,PRINT
изготовление картонные коробки для упаковки,коробки на заказ,,95,,PRINT
распечатать чертежи москва,распечатать чертеж а1,,94,,PRINT
коля дима и саша собрали вместе 30 грибов решение и чертеж,коля дима и саша собрали вместе 30 грибов решение и чертеж,,94,,PRINT
производство гидравлических цилиндров,изготовление гидроцилиндров,,94,,PRINT
чертеж мангала,мангал своими руками из металла,,93,,PRINT
распечатать чертежи а1,печать чертежей в москве,,91,,PRINT
гост оформление чертежей,гост р 21.101-2020,,91,,PRINT
чертежи деталей,чертеж детали,,91,,PRINT
печать чертежей а3 print-a1 ru,печать чертежей а0,,90,,BRANDED
печать чертежей копицентр копировальня,печать чертежа копировальня,,89,,PRINT
изготовление оснастки по чертежам заказчика,изготовление оснастки,,89,,PRINT
самарканд чертеж,самарканд чертеж,,89,,PRINT
чертеж машины,чертеж машины,,89,,PRINT
помогите начертить аксонометрический чертеж (3д вид),,,89,,PRINT
чертеж гайки,чертеж гайки,,88,,PRINT
капсульный дом чертеж,капсульный дом чертеж,,88,,PRINT
сканирование чертежей цена,сканирование чертежей,,87,,PRINT
чертежи дизайн проекта интерьера,дизайн проект квартиры чертежи,,87,,PRINT
готовый дизайн проект квартиры с чертежами,проекты ремонта квартир,,87,,PRINT
обмерные чертежи,обмерные чертежи,,87,,PRINT
обозначение сварного шва на чертеже,обозначение сварных швов на чертежах,,86,,NONTARGET
разработка км чертежей,проектирование км,,86,,PRINT
сайт металлообработки,сайт металлообработка,,86,,NONTARGET
условные обозначения на чертежах,обозначения на чертежах,,85,,PRINT
обозначение резьбы на чертеже гост,обозначение резьбы на чертеже гост,,85,,NONTARGET
рабочие чертежи для дизайн проекта,чертежи дизайн проекта интерьера,,85,,PRINT
анкерный блок аб 1,анкерный блок аб1,,85,,PRINT
экспресс печать инженерных чертежей в москве,печать инженерных чертежей,,84,,PRINT
чертеж комнаты,планировка квартиры,,84,,PRINT
стол из профильной трубы чертеж,стол из профильной трубы чертеж,,84,,PRINT
в каких единицах измерения наносятся размеры на машиностроительных чертежах,в каких единицах измерения наносятся размеры на машиностроительных чертежах,,84,,PRINT
купить тубус для чертежей,тубус,,84,,PRINT
онлайн чертеж,чертеж онлайн,,83,,PRINT
чертеж болта,чертеж болта,,83,,PRINT
мехобработка,механическая обработка металла,,83,,PRINT
чертежи для лазерной резки,макеты для лазерной резки,,83,,PRINT
изготовление металлических деталей по чертежам,изготовление деталей,,83,,PRINT
изготовление по чертежам из металла,изготовление деталей на заказ,,83,,PRINT
изготовление деталей по чертежам чпу,изготовление деталей на чпу,,83,,PRINT
чертеж лестницы,калькулятор лестницы,,83,,PRINT
распечатка и брошюровка проектной документации,печать проектной документации москва,,82,,PRINT
основная надпись чертежа гост,гост 2.104,,82,,PRINT
контрольная работа решение тригонометрических уравнений и неравенств с чертежом обязательно,контрольная работа решение тригонометрических уравнений и неравенств с чертежом обязательно,,82,,PRINT
рамка для чертежа а4 с размерами,рамка для чертежа а4,,82,,PRINT
какой шрифт используется в чертежах по госту,чертежный шрифт,,82,,PRINT
анкерный блок аб 1 цена,анкерный блок аб1,,82,,PRINT
капсульные дома российского производства,капсульный дом,,82,,PRINT
детали из металла,изготовление деталей из металла на заказ штучно,,82,,PRINT
типография печать чертежей,печать чертежей в москве,,81,,PRINT
чертеж улучшения сапог школы кота 1 найти,ведьмачьи древности снаряжение школы кота,,81,,PRINT
чертеж скворечника,скворечник своими руками из дерева чертежи с размерами,,81,,PRINT
какой способ проецирования используется при построении чертежа,виды проекций,,81,,PRINT
изготовление обечайки из металла,изготовление обечаек,,81,,PRINT
нужно начертить 3 вид для все чертежей,нужно начертить 3 вид для все чертежей,,81,,PRINT
распечатать чертежи быстро,распечатать чертежи быстро,,80,,PRINT
скворечник размеры чертеж с размерами,скворечник для скворцов,,80,,PRINT
чертеж скворечника с размерами,как сделать скворечник,,80,,PRINT
что такое местный вид на чертеже,виды на чертеже,,80,,INFO
чертеж самолета,чертеж самолета,,80,,PRINT
чертеж мукопросеивателя,чертеж мукопросеивателя,,79,,PRINT
м в круге на чертеже что значит,м в круге на чертеже что значит,,79,,PRINT
комплексный чертеж,комплексный чертеж,,79,,PRINT
чертеж детали с размерами,чертеж детали,,79,,PRINT
услуги сканирования документов цена,услуги сканирования документов,,79,,PRINT
сканировать чертежи а1,сканирование чертежей а1,,78,,PRINT
arknights endfield чертежи завода,чертежи аркнайтс эндфилд,,78,,BRANDED
производство металлоизделий по чертежам заказчика,изготовление деталей,,78,,PRINT
какой шрифт используется в чертежах в word,чертежный шрифт в ворде как называется,,78,,NONTARGET
какие размеры проставляют на сборочном чертеже,сборочный чертеж,,78,,PRINT
номинальный размер в рамке на чертеже что значит,размер в прямоугольнике на чертеже что значит,,78,,PRINT
какие размеры наносят на сборочных чертежах,сборочный чертеж,,78,,PRINT
стол гриль джентльмены,стол барбекю из джентльменов,,78,,PRINT
гост рабочая документация,гост р 21.101-2020,,78,,PRINT
начертить чертеж онлайн,чертеж онлайн,,78,,PRINT
изготовление фланцев по чертежам заказчика,изготовление фланцев,,77,,PRINT
изготовление металлоизделий по чертежам заказчика,изготовление металлоизделий по чертежам,,77,,PRINT
коробки из картона на заказ москва,изготовление коробок,,77,,PRINT
изготовление шестерни,изготовление шестерен,,77,,PRINT
чертежи на заказ,заказать чертеж онлайн,,77,,PRINT
чертежи брудеры для выращивания цыплят,брудер для цыплят своими руками чертежи,,76,,PRINT
стропильная система двухскатной крыши чертежи,стропильная система двухскатной крыши чертежи,,76,,PRINT
в каких случаях на чертежах изображают не один вид а два и более,местный вид,,76,,PRINT
ролики конвейерные поддерживающие,ролики конвейерные,,76,,PRINT
монтаж сантехнических перегородок,монтаж сантехнических перегородок,,76,,PRINT
печать чертежей рязань,печать чертежей рязань,,75,,PRINT
печать чертежей а0 в москве копировальня,печать чертежей в москве,,75,,PRINT
гост на оформление чертежей,гост р 21.101-2020,,75,,PRINT
какие линии используются в качестве размерных на чертежах,обозначение радиуса на чертеже,,75,,PRINT
какой линией изображают видимый сварной шов на чертеже,какой линией изображают видимый сварной шов на чертеже,,75,,PRINT
сборочный чертеж гост,гост 2.109,,75,,PRINT
3d принтер чертеж для травления стола,3d принтер чертеж для травления стола,,75,,BRANDED
конструкции из металла на заказ,металлоконструкции,,75,,PRINT
аркнайтс эндфилд чертежи,чертежи аркнайтс эндфилд,,74,,PRINT
какие размеры указываются на чертеже общего вида,чертеж общего вида,,74,,PRINT
проекты загородных домов и коттеджей чертежи,чертежи домов,,74,,PRINT
что значит м в круге на чертеже,м в круге на чертеже что значит,,74,,PRINT
сканирование большого формата,сканирование больших форматов москва,,74,,PRINT
изготовление фланцев на заказ,изготовление фланцев,,74,,PRINT
расчет лестницы на второй этаж в частном доме калькулятор с чертежами,калькулятор лестницы,,74,,PRINT
заказать печать чертежей,печать чертежей в москве,,73,,PRINT
обозначение сварных швов на чертеже по гост,гост 2.312-72,,73,,NONTARGET
размеры скворечника для скворцов чертеж,скворечник для скворцов,,73,,PRINT
что называется чертежом детали,что называется чертежом детали,,73,,PRINT
чертежи для 3d моделирования,чертежи для 3d моделирования,,73,,BRANDED
ra на чертеже что это,шероховатость,,73,,BRANDED
какие размеры ставятся на сборочном чертеже,сборочный чертеж,,73,,PRINT
фланцы на заказ,изготовление фланцев,,73,,PRINT
валы на заказ,производство валов,,73,,PRINT
изготовление изделий по чертежам заказчика,изготовление деталей по чертежам,,73,,PRINT
производство деталей по чертежам,изготовление деталей по чертежам,,73,,PRINT
какой линией изображают невидимый сварной шов на чертеже ответ,какой линией изображают видимый сварной шов на чертеже,,72,,PRINT
какие виды детали изображаются на чертеже,виды на чертеже,,72,,PRINT
изготовление штуцеров,изготовление штуцеров,,72,,PRINT
изготовление шкивов на заказ в москве,изготовление шкивов на заказ,,72,,PRINT
что значит размеры для справок,размер для справок на чертеже что это,,72,,PRINT
arc raiders чертежи,arc raiders чертежи,,71,,BRANDED
балаян 10-11 класс геометрия задачи на готовых чертежах,балаян 10-11 класс геометрия задачи на готовых чертежах,,71,,PRINT
гриль стол джентльмены чертеж,стол барбекю из джентльменов,,71,,PRINT
ложемент чертеж,ложемент чертеж,,71,,PRINT
что означает круг со стрелкой на чертеже,обозначения на чертежах,,71,,NONTARGET
сколько видов должен содержать рабочий чертеж детали,виды на чертеже,,71,,PRINT
изготовление деталей из металла по чертежам заказчика|3dprocess|3д процесс|3д процессы|3дпроцесс|3д-процесс|компания 3dprocess|3dprocess.ru,токарные услуги|3dprocess|3д процесс|3д процессы|3дпроцесс|3д-процесс|компания 3dprocess|3dprocess.ru,,71,,BRANDED
изготовление изделий из резины,производство рти,,71,,PRINT
размер скворечника,скворечник для скворцов,,71,,PRINT
на каких видах необходимо будет провести осевые линии при выполнении чертежа детали опора сталь,на каких видах необходимо будет провести осевые линии при выполнении чертежа детали опора сталь,,71,,PRINT
заказать распечатать чертежи,печать чертежей в москве,,70,,PRINT
печать и фальцовка чертежей копировальня,печать чертежей копицентр,,70,,PRINT
производство чертежей,производство чертежей,,70,,PRINT
чертеж общего вида гост,гост р 21.101-2020,,70,,PRINT
какие размеры наносят на сборочном чертеже,сборочный чертеж,,70,,PRINT
какие типы размеров наносят на сборочном чертеже,сборочный чертеж,,70,,PRINT
чтение чертежей,как читать чертежи,,70,,PRINT
какие виды на чертеже,виды на чертеже,,70,,PRINT
распечатка проекта,печать проектной документации москва,,70,,PRINT
кронштейны для витражей,кронштейны для витражей алюминиевых выдерживающие большие нагрузки,,70,,PRINT
какие бывают масштабы на чертеже,масштабы гост,,69,,PRINT
штуцеры металлические по чертежу,изготовление штуцеров,,69,,PRINT
стол мангал джентльмены,стол барбекю из джентльменов,,69,,PRINT
оказание услуг по металлообработке,услуги металлообработки,,69,,PRINT
проект стенда,проект стенда,,69,,PRINT
какие бывают масштабы в черчении,масштабы,,69,,PRINT
металлоконструкции по чертежам,изготовление сложных металлоконструкций,,69,,PRINT
нарисовать чертеж с размерами онлайн,чертеж онлайн,,69,,PRINT
какой угол называется внешним углом треугольника выполните чертеж,внешний угол треугольника,,69,,PRINT
услуга печати чертежей,печать чертежей рядом со мной,,68,,PRINT
укажите в каких единицах измерения проставляются линейные размеры на чертежах,нанесение размеров на чертежах,,68,,PRINT
чертеж закладной детали,серия 1.400-15 в.1 закладные изделия,,68,,PRINT
анкерный блок чертежи dwg,анкерный блок чертежи dwg,,68,,BRANDED
3d принтер чертеж для травления стола горячий,3d принтер чертеж для травления стола,,68,,BRANDED
ведьмак 3 чертежи школы волка консоль,консольные команды ведьмака 3,,68,,PRINT
что значит м12 на чертеже,как обозначается метрическая резьба,,68,,PRINT
чертеж одноэтажного дома,проекты одноэтажных домов,,68,,PRINT
что означает литера на чертеже,литера о1,,68,,NONTARGET
копирование чертежей цена,копирование чертежей,,67,,PRINT
компас 3д онлайн открыть чертеж,компас 3д онлайн открыть чертеж,,67,,PRINT
опора контактной сети жд чертеж,опора контактной сети жд чертеж,,67,,PRINT
металлоизделия на заказ по чертежам,изделия из металла под заказ,,67,,PRINT
анкерный блок чертеж,анкерный блок чертеж,,67,,PRINT
детали по чертежам|3dprocess|3д процесс|3д процессы|3дпроцесс|3д-процесс|компания 3dprocess|3dprocess.ru,токарные услуги|3dprocess|3д процесс|3д процессы|3дпроцесс|3д-процесс|компания 3dprocess|3dprocess.ru,,67,,BRANDED
что означает s3 на чертеже,что означает s3 на чертеже,,67,,NONTARGET
что означает буква м в кружочке на чертеже,м в круге на чертеже что значит,,67,,NONTARGET
какие сведения можно получить рассматривая фасад на чертеже,какие сведения можно получить рассматривая фасад на чертеже,,67,,PRINT
распечатать проект цена,печать проектной документации москва,,67,,PRINT
стальные опоры контактной сети,опора контактной сети металлическая,,67,,PRINT
закладные детали мн серия,закладные детали мн серия,,67,,PRINT
какой шрифт в автокаде,какой шрифт используется в автокаде для чертежей,,67,,PRINT
монтаж металлоконструкций чертежи,чертежи металлоконструкций,,67,,PRINT
сканирование проектов и чертежей,сканирование чертежей москва,,66,,PRINT
обозначения на чертеже,как читать чертежи,,66,,PRINT
какой шрифт используется в автокаде для чертежей,какой шрифт используется в автокаде для чертежей,,66,,PRINT
основная надпись на чертеже,гост 2.104,,66,,PRINT
анкерный блок а1 чертеж,анкерный блок а1 чертеж,,66,,PRINT
анкерные блоки для фундамента чертеж,анкерный блок чертеж,,66,,PRINT
гост 2.109-2023 ескд основные требования к чертежам,гост р 2.109-2023,,66,,PRINT
изготовление втулок по чертежам|3dprocess|3д процесс|3д процессы|3дпроцесс|3д-процесс|компания 3dprocess|3dprocess.ru,токарные услуги|3dprocess|3д процесс|3д процессы|3дпроцесс|3д-процесс|компания 3dprocess|3dprocess.ru,,66,,BRANDED
стул в стиле лофт чертеж,стулья в стиле лофт своими руками,,66,,PRINT
чертеж коробки с размерами,развертка коробки,,66,,PRINT
какие виды бывают на чертеже,виды на чертеже,,66,,PRINT
угловая кухня чертеж,угловая кухня чертеж,,66,,PRINT
нужно ли на сборочных чертежах наносить все размеры деталей входящих в изделие почему,нужно ли на сборочных чертежах наносить все размеры деталей входящих в изделие почему,,66,,PRINT
сколько вы знаете вариантов задания проекций плоскостей на комплексном чертеже,сколько вы знаете вариантов задания проекций плоскостей на комплексном чертеже,,66,,PRINT
проточка что это на чертеже,проточка на чертеже,,66,,PRINT
печать чертежей на цопы ру,стоимость печати чертежей,,66,,PRINT
серия детали закладные,серия 1.400-15 в.1 закладные изделия,,66,,PRINT
монтаж анкерных блоков,монтаж анкерных блоков,,66,,PRINT
изготовление мебели по индивидуальному проекту,мебель на заказ,,66,,PRINT
производство деталей по чертежам|3dprocess|3д процесс|3д процессы|3дпроцесс|3д-процесс|компания 3dprocess|3dprocess.ru,токарные услуги|3dprocess|3д процесс|3д процессы|3дпроцесс|3д-процесс|компания 3dprocess|3dprocess.ru,,66,,BRANDED
