query,cluster,group,demand,comp,category
печать проектной документации москва,печать проектной документации москва,,11754,,PRINT
печать проектной документации,печать проектной документации москва,,7412,,PRINT
печать чертежей в москве,печать чертежей в москве,,5860,,PRINT
сканирование чертежей а0,сканирование чертежей а1,,5103,,PRINT
сканирование чертежей а1,сканирование чертежей а1,,4976,,PRINT
печать чертежей а1,печать чертежей в москве,,4431,,PRINT
печать чертежей молодежная,печать чертежей молодежная,,4314,,PRINT
сканирование больших форматов москва,сканирование больших форматов москва,,4083,,PRINT
печать чертежей текстильщики,печать чертежей текстильщики,,3688,,PRINT
оцифровка чертежей,оцифровка чертежей,,3688,,PRINT
распечатать проектную документацию,печать проектной документации москва,,3505,,PRINT
печать чертежа,печать чертежей в москве,,3492,,PRINT
сканирование чертежей,сканирование чертежей а1,,3411,,PRINT
широкоформатное сканирование чертежей,сканирование больших форматов москва,,3279,,PRINT
печать чертежей а0,печать чертежей в москве,,3218,,PRINT
ту 160,ту 160,,3213,,PRINT
копирование чертежей а1,копирование чертежей а1,,3101,,PRINT
печать чертежей а1 в москве,печать чертежей в москве,,3092,,PRINT
печать чертежей пролетарская,печать чертежей пролетарская,,3084,,PRINT
стоимость печати чертежей,печать чертежей в москве,,2857,,PRINT
печать чертежей а3,печать чертежей в москве,,2824,,PRINT
печать чертежей а2 цена,печать чертежей в москве,,2752,,PRINT
печать чертежей недорого,печать чертежей в москве,,2689,,PRINT
печать чертежей а0 в москве,печать чертежей в москве,,2675,,PRINT
сканирование чертежей большого формата,сканирование чертежей а1,,2654,,PRINT
печать чертежей,печать чертежей в москве,,2645,,PRINT
печать чертежей а2,печать чертежей в москве,,2598,,PRINT
печать чертежей а3 формат,печать чертежей в москве,,2463,,PRINT
распечатка чертежей а1,печать чертежей в москве,,2417,,PRINT
печать чертежей а2 москва,печать чертежей в москве,,2375,,PRINT
печать проектов и чертежей,печать проектов,,2338,,PRINT
распечатка чертежей,печать чертежей в москве,,2321,,PRINT
распечатка чертежей а0,печать чертежей в москве,,2266,,PRINT
фальцовка чертежей цена,фальцовка чертежей цена,,2260,,PRINT
сканирование больших форматов,сканирование больших форматов москва,,2207,,PRINT
распечатать чертеж а1,печать чертежей в москве,,2191,,PRINT
копирование чертежей,копирование чертежей а1,,2182,,PRINT
печать чертежей формат а1,печать чертежей в москве,,2149,,PRINT
печать чертежей рядом,печать чертежей в москве,,2141,,PRINT
сканирование чертежей москва,сканирование чертежей а1,,2086,,PRINT
копирование и печать чертежей,печать проектов и чертежей,,2008,,PRINT
печать чертежей автозаводская,печать чертежей автозаводская,,1988,,PRINT
печать инженерных чертежей,печать инженерных чертежей,,1898,,PRINT
инженерная печать чертежей в москве,печать инженерных чертежей,,1766,,PRINT
распечатать чертеж,печать чертежей а0,,1731,,PRINT
печать чертежей а1 а2,печать чертежей в москве,,1721,,PRINT
чертеж,чертеж,,1699,,PRINT
печать чертежей а1 цена,печать чертежей в москве,,1637,,PRINT
типография инженерной печати,типография инженерной печати,,1561,,PRINT
печать чертежей больших форматов,печать чертежей в москве,,1530,,PRINT
отсканировать чертежи,сканирование чертежей а0,,1493,,PRINT
распечатать чертежи рядом со мной,печать чертежей в москве,,1481,,PRINT
печать чертежей люблино,печать чертежей люблино,,1476,,PRINT
заказать чертеж онлайн,заказать чертеж онлайн,,1462,,PRINT
срочная печать чертежей а2,печать чертежей в москве,,1389,,PRINT
широкоформатная печать чертежей,печать чертежей а3,,1334,,PRINT
типография чертежи печать,печать проектов и чертежей,,1302,,PRINT
черчение чертежей на заказ,заказать чертеж онлайн,,1277,,PRINT
печать чертежей а2 рядом со мной,печать чертежей в москве,,1267,,PRINT
изготовление деталей по чертежам,изготовление деталей по чертежам,,1253,,PRINT
распечатать чертежи в москве,печать чертежей в москве,,1223,,PRINT
печать чертежей копицентр,печать чертежей копицентр,,1223,,PRINT
печать больших чертежей,печать чертежей в москве,,1159,,PRINT
изготовление металлоконструкций москва,изготовление металлоконструкций,,1142,,PRINT
срочная печать чертежей а1,печать чертежей в москве,,1085,,PRINT
услуги печати чертежей,печать чертежей в москве,,1082,,PRINT
печать чертежей формат,печать чертежей в москве,,1073,,PRINT
печать документации,печать проектной документации,,1052,,PRINT
распечатка чертежей формата а1,печать чертежей в москве,,1038,,PRINT
изготовление деталей из металла,изготовление деталей на заказ,,1024,,PRINT
печать чертежей в цвете,печать чертежей в москве,,1021,,PRINT
распечатать чертежи а1 москва,печать чертежей в москве,,1006,,PRINT
изготовление деталей на заказ,изготовление деталей на заказ,,999,,PRINT
печать и фальцовка чертежей,печать проектов и чертежей,,984,,PRINT
печать проектов и чертежей москва,печать проектов,,981,,PRINT
инженерная печать чертежей а2,печать проектов и чертежей,,959,,PRINT
печать схем и чертежей,печать чертежей а0,,931,,PRINT
оцифровать чертеж,оцифровка чертежей,,900,,PRINT
печать чертежей формата a1 в москве,печать чертежей в москве,,898,,BRANDED
печать чертежей а1 а0,печать чертежей в москве,,894,,PRINT
где распечатать чертежи а1,печать чертежей в москве,,881,,PRINT
срочная печать чертежей,печать чертежей а0,,873,,PRINT
изготовление металлоконструкций по чертежам,металлоконструкции,,853,,PRINT
изготовление мебели по индивидуальным размерам,мебель на заказ,,841,,PRINT
печать проектной документации чертежей,печать проектной документации москва,,831,,PRINT
копия чертежа,копирование чертежей,,824,,PRINT
печать чертежей рядом со мной,печать чертежей в москве,,813,,PRINT
профессиональная печать больших чертежей в москве,печать чертежей в москве,,811,,PRINT
фальцовка,фальцовка,,810,,PRINT
черно белая печать чертежей,печать проектов и чертежей,,789,,PRINT
чертежи,чертеж,,787,,PRINT
печать чертежей по приемлемой цене,печать чертежей в москве,,770,,PRINT
печать цветных чертежей,печать чертежей в москве,,765,,PRINT
изготовление деталей,изготовление деталей на заказ,,742,,PRINT
распечатать проект,печать проектной документации москва,,742,,PRINT
где можно распечатать чертежи на ватмане,распечатать чертежи рядом со мной,,731,,PRINT
распечатка чертежей а3,печать чертежей в москве,,725,,PRINT
изготовление деталей по чертежам заказчика,изготовление деталей по чертежам,,711,,PRINT
печать чертежей а4,печать проектной документации,,707,,PRINT
печать чертежей по выгодным ценам,печать чертежей в москве,,693,,PRINT
печать чертежей а2 цена o-format,печать чертежей в москве,,683,,BRANDED
инженерная печать,инженерная печать чертежей в москве,,677,,PRINT
печать рабочей документации,печать рабочей документации,,651,,PRINT
профессиональная печать чертежей,печать чертежей в москве,,640,,PRINT
срочная печать чертежей а0,печать чертежей в москве,,635,,PRINT
заказ печати чертежей в москве,печать чертежей в москве,,626,,PRINT
производство и монтаж металлоконструкций,металлоконструкции,,622,,PRINT
копировальный центр печать чертежей,печать чертежей в москве,,621,,PRINT
цифровая печать чертежей a1 в москве,печать чертежей в москве,,616,,BRANDED
распечатка чертежей а2,печать чертежей в москве,,614,,PRINT
копирование чертежей больших форматов в москве,копирование чертежей,,613,,PRINT
металлоконструкции на заказ в москве,металлоконструкции,,599,,PRINT
срочная печать чертежей в москве,печать чертежей недорого,,597,,PRINT
ксерокопия чертежей большого формата,копирование чертежей,,592,,PRINT
широкоформатная печать чертежей в москве,печать чертежей а3,,591,,PRINT
цифровая печать чертежей,печать чертежей,,578,,PRINT
сканы чертежей,сканирование чертежей а0,,572,,PRINT
производство металлоизделий,металлоизделия на заказ,,571,,PRINT
распечатать чертежи а2,печать чертежей в москве,,565,,PRINT
распечатать документацию,печать проектной документации москва,,556,,PRINT
цифровая печать чертежей в москве,печать чертежей в москве,,552,,PRINT
чертеж дома,чертеж дома,,547,,PRINT
балаян 7-9 класс геометрия задачи на готовых чертежах,балаян 7-9 класс геометрия задачи на готовых чертежах,,545,,PRINT
ксерокс чертежей,копирование чертежей а1,,541,,PRINT
печать больших чертежей в москве,печать чертежей в москве,,533,,PRINT
купить чертеж,заказать чертеж онлайн,,528,,PRINT
проект кмд,кмд,,528,,PRINT
чертеж откатных ворот,откатные ворота 4м чертежи размеры схемы,,527,,PRINT
инженерная печать чертежей o-format,печать чертежей копицентр,,524,,BRANDED
печать чертежей пролетарская копировальня,печать чертежей пролетарская копировальня,,519,,PRINT
сканировать чертежи,сканирование чертежей а1,,519,,PRINT
копия чертеж а1,копирование чертежей а1,,519,,PRINT
изготовление металлоизделий,изготовление металлических изделий на заказ,,508,,PRINT
изготовление деталей по чертежам заказчика металлообработка,изготовление деталей на заказ,,505,,PRINT
изготовление деталей из стали на заказ,изготовление деталей,,504,,PRINT
откатные ворота 4 метра чертеж,откатные ворота 4 метра чертеж,,501,,PRINT
откатные ворота чертежи с размерами,откатные ворота 4 метра чертеж,,496,,PRINT
печать чертежей а1 а1,печать чертежей в москве,,489,,PRINT
напечатать чертеж,печать чертежей в москве,,488,,PRINT
лучшие услуги по печати чертежей a1 в москве,печать чертежей в москве,,485,,BRANDED
металлообработка по чертежам,изготовление деталей по чертежам,,478,,PRINT
инженерная печать чертежей,печать инженерных чертежей,,475,,PRINT
печать чертежей на плоттере,распечатать чертеж,,474,,PRINT
изготовление по чертежам заказчика,изготовление деталей по чертежам,,474,,PRINT
печать чертежей цена,печать чертежей в москве,,472,,PRINT
офсетная печать чертежей,офсетная печать чертежей,,472,,PRINT
печать чертежей центр,печать чертежей в москве,,469,,PRINT
откатные ворота 4м чертежи размеры схемы,откатные ворота 4 метра чертеж,,469,,PRINT
откатные ворота с калиткой чертеж на 4м проем,откатные ворота 4 метра чертеж,,469,,PRINT
печать чертежей г,печать чертежей в москве,,451,,PRINT
цветная печать чертежей а3,печать чертежей в москве,,448,,PRINT
инженерная печать чертежей а1,печать проектов и чертежей,,448,,PRINT
инженерная печать чертежей а0,печать проектов и чертежей,,448,,PRINT
круглосуточная печать чертежей в москве,печать чертежей больших форматов,,440,,PRINT
распечатать чертежи а3,печать чертежей в москве,,439,,PRINT
печать чертежей формата а3,печать чертежей а3,,428,,PRINT
изготовление деталей из металла по чертежам заказчика,изготовление деталей по чертежам,,422,,PRINT
фальцовка чертежей,фальцовка чертежей цена,,421,,PRINT
широкоформатная печать срочная печать чертежей,печать чертежей в москве,,421,,PRINT
печать чертежа копировальня,печать чертежа копировальня,,420,,PRINT
заказать чертеж в автокаде,заказать чертеж в автокаде,,420,,PRINT
печать чертежей дешево,печать чертежей в москве,,417,,PRINT
печать чертежей срочно,печать чертежей в москве,,414,,PRINT
изготовление металлоконструкций по чертежам заказчика,изготовление металлоконструкций на заказ в москве,,412,,PRINT
металлообработка по чертежам заказчика,услуги по металлообработке и изготовлению деталей,,410,,PRINT
сборочный чертеж,сборочный чертеж,,410,,PRINT
экспресс-печать чертежей a1 в москве,печать чертежей в москве,,408,,BRANDED
токарное изготовление деталей,токарные работы,,398,,PRINT
печать чертежей формата а1,печать чертежей в москве,,387,,PRINT
печать чертежей а2 в москве,печать чертежей в москве,,384,,PRINT
печать чертежей а1 цены,стоимость печати чертежей,,383,,PRINT
брошюровка чертежей,брошюровка чертежей,,378,,PRINT
печать чертежей а0 цена,печать чертежей недорого,,370,,PRINT
печать чертежей с доставкой,печать чертежей в москве,,369,,PRINT
какой угол называется внешним углом треугольника,внешний угол треугольника,,367,,PRINT
печать проектов и чертежей копировалня ру,печать чертежей а0,,362,,PRINT
печать чертежей а0 биг формат,печать чертежей в москве,,360,,PRINT
печать проектов и чертежей москва копировалня ру,печать проектной документации,,359,,PRINT
копирование чертежей больших форматов,копирование чертежей а1,,352,,PRINT
изготовление гидроцилиндров в москве и области,изготовление гидроцилиндров,,351,,PRINT
изготовление детали из нержавейки по чертежу,изделия из нержавейки на заказ,,351,,PRINT
круглосуточная печать чертежей,срочная печать чертежей а2,,350,,PRINT
услуги металлообработки в москве,металлообработка,,349,,PRINT
изготовление металлоконструкций в москве,изготовление металлоконструкций,,346,,PRINT
чертеж детали,чертеж детали,,341,,PRINT
заказать чертеж в компасе,заказать чертеж в компасе,,340,,PRINT
офсетная печать чертежей а1 в москве,офсетная печать чертежей а1 в москве,,338,,PRINT
копирование проектной документации,копирование проектной документации,,332,,PRINT
чертеж онлайн,чертеж онлайн,,329,,PRINT
токарная обработка на заказ,токарные работы,,315,,PRINT
экспресс-печать инженерных чертежей в москве,печать инженерных чертежей,,313,,PRINT
брошюровка чертежей цена,брошюровка чертежей цена,,313,,PRINT
детали по чертежам заказчика,изготовление деталей по чертежам заказчика,,312,,PRINT
сканирование чертежей в москве,сканирование чертежей а1,,311,,PRINT
распечатать чертежи в москве с доставкой,печать чертежей в москве,,306,,PRINT
где заказать срочную печать чертежей в москве,печать чертежей в москве,,306,,PRINT
расчет лестницы онлайн калькулятор с чертежами,калькулятор лестницы,,303,,PRINT
печать чертежей а1 o-format,печать чертежей в москве,,301,,BRANDED
сканирование чертежей а0 копировальня,сканирование чертежей москва,,300,,PRINT
изготовление металлических изделий на заказ,изготовление металлических изделий на заказ,,299,,PRINT
онлайн заказ печати чертежей,стоимость печати чертежей,,295,,PRINT
купить чертеж в компасе,заказать чертеж в компасе,,295,,PRINT
металлообработка изготовление деталей по чертежам,изготовление деталей на заказ,,294,,PRINT
печать чертежей москва,печать чертежей в москве,,292,,PRINT
калькулятор крыши,калькулятор кровли,,287,,PRINT
заказать чертеж,заказать чертеж онлайн,,285,,PRINT
чертежи аркнайтс эндфилд,чертежи аркнайтс эндфилд,,282,,PRINT
изготовление по чертежам,изготовление деталей по чертежам,,282,,PRINT
резка металла по чертежам,услуги по резке металла,,275,,PRINT
резка металла на заказ,лазерная резка металла цена,,275,,PRINT
купить чертежи в компасе готовые,купить чертеж в компасе,,274,,PRINT
купить чертежи в компасе 3д,заказать чертеж в компасе,,274,,PRINT
изготовление кронштейнов,изготовление кронштейнов,,269,,PRINT
копирование чертежей а2,копирование чертежей а2,,268,,PRINT
стоимость чертежей на заказ,заказать чертеж онлайн,,267,,PRINT
копирование чертежей а0,копирование чертежей а0,,265,,PRINT
копирование чертежей в москве,копирование чертежей,,265,,PRINT
основная надпись чертежа,основная надпись чертежа,,263,,PRINT
помогите пожалуйста завтра иду решать контрольную тема параллельность в пространстве можете дать решение и чертежи,помогите пожалуйста завтра иду решать контрольную тема параллельность в пространстве можете дать решение и чертежи,,260,,PRINT
чертежи купить,заказать чертеж онлайн,,259,,PRINT
распечатка чертежей копировальня,печать чертежа копировальня,,253,,PRINT
обзор папок для чертежей,обзор папок для чертежей,,252,,PRINT
копирование рабочей документации,копирование проектов,,252,,PRINT
инженерная графика чертежи купить,инженерная графика чертежи купить,,251,,PRINT
