query,cluster,group,demand,comp,category
печать чертежей а2 цена копировальня,стоимость печати чертежей,,52,,PRINT
чертежи arc raiders,arc raiders чертежи,,52,,BRANDED
чертеж камеры дробеструйной,чертеж камеры дробеструйной,,52,,PRINT
крыльчатки из металла по чертежу,крыльчатки из металла по чертежу,,52,,PRINT
изготовить детали из металла по чертежам заказчика,изготовление деталей по чертежам,,52,,PRINT
удлинители металлические по чертежу,удлинители металлические по чертежу,,52,,PRINT
компоненты для протезирования по чертежу,компоненты для протезирования по чертежу,,52,,PRINT
изготовление муфт по чертежам,изготовление муфт,,52,,PRINT
декоративные изделия для интерьера из металла по чертежу,декоративные изделия для интерьера из металла по чертежу,,52,,PRINT
сколько проекций должно быть на чертеже,виды проекций,,52,,PRINT
рабинович 10-11 класс геометрия задачи на готовых чертежах,рабинович 10-11 класс геометрия задачи на готовых чертежах,,52,,PRINT
чертеж квартиры 10 букв,чертеж квартиры 10 букв,,52,,PRINT
стоимость оцифровки документов,сканирование документации,,52,,PRINT
дробеструйные обитаемые камеры,обитаемая дробеструйная камера,,52,,PRINT
производство кронштейнов,изготовление кронштейнов,,52,,PRINT
распечатать проекты в москве,печать проектной документации москва,,52,,PRINT
производство деталей на заказ,изготовление деталей по чертежам,,52,,PRINT
гост размеры,гост 2.307,,52,,PRINT
копировальный центр москва,копировальный центр,,52,,PRINT
чертеж модульной бани баниум-дом ру,чертеж модульной бани баниум-дом ру,,52,,PRINT
оцифровка чертежей вакансии,оцифровка чертежей вакансии,,51,,PRINT
печать чертежей быстро,печать чертежей в москве,,51,,PRINT
рамка чертежа гост,гост 2.104,,51,,PRINT
чертежи блочного лука,блочный лук конструкция чертежи,,51,,PRINT
векторизация чертежей,векторизация чертежей,,51,,PRINT
изготовление шкивов по чертежам,изготовление шкивов на заказ,,51,,PRINT
дробеструйные камеры чертеж,чертеж камеры дробеструйной,,51,,PRINT
муфты зубчатые по чертежам,муфты зубчатые по чертежам,,51,,PRINT
кресло кентуки чертеж и схема сборки,кресло кентукки своими руками,,51,,PRINT
входные двери на заказ по чертежу,входные двери на заказ по чертежу,,51,,PRINT
что означает размер в рамке,размер в прямоугольнике на чертеже что значит,,51,,NONTARGET
изготовление деталей по чертежам заказчика из стали,изготовление деталей по чертежам,,51,,PRINT
выполнение чертежей на заказ,заказать чертеж онлайн,,51,,PRINT
печать и брошюровка проектной документации,печать проектной документации москва,,50,,PRINT
endfield чертежи,чертежи аркнайтс эндфилд,,50,,BRANDED
брудер для цыплят чертежи фото,брудер для цыплят своими руками,,50,,PRINT
состав чертежей дизайн проекта,состав дизайн проекта,,50,,PRINT
дробеструйная камера чертежи,чертеж камеры дробеструйной,,50,,PRINT
чертежи дробеструйных камер,пескоструйная камера своими руками чертежи с размерами,,50,,PRINT
дробеструйная камера чертеж,чертеж камеры дробеструйной,,50,,PRINT
чертежи дробеструйной камеры,пескоструйная камера своими руками чертежи с размерами,,50,,PRINT
изготовление валов по чертежу,производство валов,,50,,PRINT
камера дробеструйная чертежи,чертеж камеры дробеструйной,,50,,PRINT
электротехническая продукция по чертежу,электротехнические изделия на заказ,,50,,PRINT
производство соединительных муфт,изготовление муфт,,50,,PRINT
обработка цветных металлов на токарном станке,токарная обработка цветных металлов,,50,,PRINT
печать дизайн проекта,распечатка проектной документации,,50,,PRINT
фланец на делитель изготовление по чертежу,изготовление фланцев,,50,,PRINT
изготовление мебели по чертежам заказчика fabrika-obivki,изготовление мебели по чертежам заказчика fabrika-obivki,,50,,BRANDED
изготовление изделий деталей по чертежам,изготовление деталей из металла,,50,,PRINT
что означает штриховка на чертеже,что означает штриховка на чертеже,,49,,NONTARGET
ксиранитовый компонент чертеж,ксиранитовый компонент чертеж,,49,,PRINT
расчет крыши онлайн калькулятор с чертежами,калькулятор кровли,,49,,PRINT
чертеж детали в 3х видах спереди сбоку и сверху,,,49,,PRINT
штуцеры по чертежам изготовление,изготовление штуцеров,,49,,PRINT
изготовление штуцеров по чертежам,изготовление штуцеров,,49,,PRINT
чертеж дробеструйной камеры,пескоструйная камера своими руками чертежи с размерами,,49,,PRINT
корпусные детали по чертежу,изготовление металлических деталей по чертежам,,49,,PRINT
футорки металлические по чертежу,футорки из металла на заказ,,49,,PRINT
что обозначает пунктирная линия на чертеже,линии чертежа,,49,,NONTARGET
технические требования на чертеже гост,гост 2.316,,49,,PRINT
шрифт для чертежей,чертежный шрифт,,49,,PRINT
изготовление муфт для насосов,изготовление муфт,,49,,PRINT
документация дизайн проекта интерьера,состав дизайн проекта,,49,,PRINT
цветная печать чертежей,печать чертежей формата а1,,48,,PRINT
печать крупноформатных чертежей,распечатать чертежи рядом со мной,,48,,PRINT
оцифровка чертежей в компас,оцифровка чертежей в компас,,48,,PRINT
чертеж деревянной фермы 6 метров,как сделать ферму на 6 метров из дерева,,48,,PRINT
звездочки из металла по чертежу,звездочки металлические по чертежу,,48,,PRINT
задачи на готовых чертежах 7 класс геометрия,задачи на готовых чертежах,,48,,PRINT
муфта по чертежу,изготовление муфт,,48,,PRINT
фланцы по чертежам,изготовление фланцев,,48,,PRINT
крышки металлические по чертежу,крышки металлические по чертежу,,48,,PRINT
изготовление штуцера,изготовление штуцеров,,48,,PRINT
тара деревянная,деревянный ящик,,48,,PRINT
заказать чертежи частного дома,проектирование домов,,48,,PRINT
печать чертежей а3 копировальня,копирование и печать чертежей,,47,,PRINT
печать чертежей а1 цена копировальня,распечатка чертежей а0 копировальня,,47,,PRINT
47,печать чертежей в москве,,47,,PRINT
чертежи аркнайтс,чертежи аркнайтс эндфилд,,47,,PRINT
вылет диска что это такое на чертеже,ет,,47,,PRINT
3д сканер для чертежей,3d сканер для 3d принтера,,47,,PRINT
дробеструйные камеры чертежи,чертеж камеры дробеструйной,,47,,PRINT
футорки из металла по чертежу,футорки из металла на заказ,,47,,PRINT
корпусные изделия по чертежу,корпусные детали по чертежу,,47,,PRINT
изделия по чертежам заказчика,изготовление деталей по чертежам,,47,,PRINT
рабинович 7-9 класс геометрия задачи на готовых чертежах,рабинович геометрия 7-9 задачи на готовых чертежах скачать бесплатно,,47,,PRINT
каким знаком обозначается диаметр на чертеже,обозначение диаметра на чертеже,,47,,NONTARGET
размеры рамки для чертежа а4,рамка для черчения,,47,,PRINT
printbot крепление к экструдеру хотенда,printbot крепление к экструдеру хотенда чертеж,,47,,BRANDED
изготовление детали на заказ,изготовление деталей на заказ,,47,,PRINT
лазерная резка металла по чертежам заказчика pf resurs,лазерная резка металла в спб,,47,,BRANDED
сканировать чертежи москва,сканирование чертежей большого формата,,46,,PRINT
сканы чертежей копировальня,сканы чертежей копировальня,,46,,PRINT
сканирование широкоформатное москва,сканирование больших форматов москва,,46,,PRINT
упрощенное обозначение отверстий на чертежах гост,упрощенное обозначение отверстий на чертежах гост,,46,,NONTARGET
правила оформления чертежей гост,гост р 21.101-2020,,46,,PRINT
что такое основная надпись на чертеже,гост 2.104,,46,,INFO
все чертежи арк райдерс,arc raiders чертежи,,46,,PRINT
схема чертежа шкатулки из картона,схема чертежа шкатулки из картона,,46,,PRINT
отделка квартир в москве под ключ недорого с комплектацией чертежей в москве remont-msk24.ru,ремонт москва квартиры,,46,,BRANDED
электротехнические изделия по чертежу,электротехнические изделия по чертежу,,46,,PRINT
детали клапанов металлические по чертежу,детали клапанов металлические по чертежу,,46,,PRINT
ниппели металлические по чертежу,ниппели из металла на заказ,,46,,PRINT
крыльчатки металлические по чертежу,крыльчатки из металла по чертежу,,46,,PRINT
детали из металла по чертежам,изготовление деталей по чертежам,,46,,PRINT
ксерокс чертежей на цопы ру,ксерокс чертежей на цопы ру,,46,,PRINT
чертеж выставочного стенда,чертеж выставочного стенда,,46,,PRINT
жби по чертежам,жби по чертежу изготовление,,46,,PRINT
printbot крепление к экструдеру хотенда чертеж маунтин,printbot крепление к экструдеру хотенда чертеж,,46,,BRANDED
электронный архив проектной документации,электронный архив проектной документации,,46,,PRINT
изготовить тэн,производство тэнов,,46,,PRINT
изготовление ящиков из дерева,изготовление деревянных ящиков,,46,,PRINT
деревянная ферма 6 метров,деревянная ферма 6 метров,,46,,PRINT
каркасные дома чертежи проекты,проект каркасного дома бесплатно с чертежами,,46,,PRINT
широкоформатная печать чертежи,печать чертежей а0 в москве,,45,,PRINT
печать чертежей а2 копировальня,печать чертежей копицентр,,45,,PRINT
какой шрифт используется в чертежах по госту в автокаде,какой шрифт используется в автокаде для чертежей,,45,,PRINT
что такое спецификация чертежа,спецификация чертежа,,45,,INFO
анкерные блоки для фундамента чертеж ar-farvater,стоимость анкерного блока ar-farvater,,45,,BRANDED
лазерная сварка на чертеже rustan,лазерная сварка на чертеже rustan,,45,,BRANDED
крышки из металла по чертежу,крышки металлические по чертежу,,45,,PRINT
какой шрифт используется в чертежах по госту в ворде,чертежный шрифт в ворде как называется,,45,,NONTARGET
дробеструйной чертеж камеры,чертеж камеры дробеструйной,,45,,PRINT
размеры рамки для чертежа,рамка для черчения,,45,,PRINT
изготовление металлоконструкций на заказ москва,металлоконструкции,,45,,PRINT
изготовление обечаек из нержавейки,изготовление обечаек из нержавейки,,45,,PRINT
схема выставочного стенда,схема выставочного стенда,,45,,PRINT
chicken tractor,chicken tractor,,45,,BRANDED
изделия из металлоконструкций,изготовление металлоконструкций,,45,,PRINT
построение чертежа юбки полусолнце,юбка полусолнце выкройка,,44,,PRINT
барбекю из кирпича чертежи схемы фото,барбекю своими руками чертежи и фото пошаговая инструкция,,44,,PRINT
транспортировочный чертеж,транспортировочный чертеж,,44,,PRINT
анкерный блок чертеж ar-farvater,анкерный блок чертеж,,44,,BRANDED
анкерный блок аб 1 чертеж ar-farvater,анкерный блок аб 1 чертеж ar-farvater,,44,,BRANDED
муфты по чертежам,изготовление муфт,,44,,PRINT
изготовление муфт по чертежу,изготовление муфт,,44,,PRINT
спецметизы по чертежу,спецметизы по чертежу,,44,,PRINT
пробки металлические по чертежу,пробки из металла на заказ,,44,,PRINT
какой такой чертеж все на димкин глазок,какой такой чертеж все на димкин глазок,,44,,PRINT
подготовка чертежей взрывозащиты,подготовка чертежей взрывозащиты,,44,,PRINT
типография печать проектов,печать проектной документации москва,,44,,PRINT
изготовление из латуни,изготовление из латуни,,44,,PRINT
изготовление деталей по чертежам заказчика металлообработка arretir,изготовление деталей из металла,,44,,BRANDED
ту 160 чертеж,ту 160 чертеж,,44,,PRINT
изготовление деталей из полиамида по чертежам заказчика,изготовление деталей из полиамида,,44,,PRINT
разработка чертежей кмд ar-farvater,разработка чертежей кмд ar-farvater,,44,,BRANDED
какой шрифт используется в документах по госту в чертежах,чертежный шрифт,,43,,PRINT
спецификация на чертеже гост,гост 2.106,,43,,PRINT
изготовление оснастки по чертежам,изготовление оснастки,,43,,PRINT
расчет кровли онлайн калькулятор с чертежами,калькулятор кровли,,43,,PRINT
чертеж ресторана,чертеж ресторана,,43,,PRINT
муфты по чертежам заказчика,изготовление муфт,,43,,PRINT
шкивы по чертежу,изготовление шкивов на заказ,,43,,PRINT
printbot чертеж маунтин плата,printbot крепление к экструдеру хотенда чертеж,,43,,BRANDED
купить чертежи арк райдерс,купить чертежи арк райдерс,,43,,PRINT
что такое главный вид на чертеже,виды на чертеже,,43,,INFO
стоимость обмерных чертежей,обмерные работы цена,,43,,PRINT
алюминиевый профиль под заказ,алюминиевый профиль на заказ,,43,,PRINT
металлообработка изготовление деталей,изготовление деталей на заказ,,43,,PRINT
изготовление изделий из стали,изготовление металлических изделий,,43,,PRINT
кто рисует проекты домов,кто занимается проектированием домов,,43,,PRINT
ведомость спецификаций,гост 2.106,,43,,PRINT
изготовление мебели по чертежам fabrika-obivki,ремонт мебели fabrika-obivki,,43,,BRANDED
изготовление металлоконструкций по чертежам itpmet.ru,металлоконструкции на заказ,,43,,BRANDED
металлокаркас под сэндвич панели чертежи,металлокаркас под сэндвич панели чертежи,,43,,PRINT
кто делает чертежи для строительства,кто делает чертежи для строительства,,42,,PRINT
где искать чертежи arc raiders,arc raiders чертежи,,42,,BRANDED
изготовление коробок по чертежу sp15 ru,изготовление короба sp15 ru,,42,,BRANDED
ступицы по чертежу,ступицы на заказ,,42,,PRINT
какой шрифт используется в чертежах по госту в word,чертежный шрифт в ворде как называется,,42,,NONTARGET
заглушки из металла по чертежу,заглушки из металла по чертежу,,42,,PRINT
камеры дробеструйной чертежи,чертеж камеры дробеструйной,,42,,PRINT
обувница чертеж,обувница своими руками чертежи и схемы,,42,,PRINT
садовая скамейка чертежи с размерами скамейки урны,садовая скамейка чертежи с размерами скамейки урны,,42,,PRINT
вылет ет на дисках что это значит на что влияет,ет,,42,,PRINT
литье из полиамида,изготовление деталей из полиамида,,42,,PRINT
рабочий проект интерьера,дизайн проект,,42,,PRINT
чертеж мангала с размерами из металла,чертеж мангала,,42,,PRINT
копирование и печать чертежей копировальня,копирование и печать чертежей,,41,,PRINT
размеры на чертеже гост,гост 2.307,,41,,PRINT
чертежи арк райдерс,arc raiders чертежи,,41,,PRINT
чертежи дробеструйные камеры,пескоструйная камера своими руками чертежи с размерами,,41,,PRINT
изделия из полиамида по чертежам,изготовление деталей из полиамида,,41,,PRINT
пробки из металла по чертежу,пробки из металла на заказ,,41,,PRINT
онлайн калькулятор кровли,калькулятор кровли,,41,,PRINT
паспорт на дробеструйную камеру,руководство по эксплуатации дробеструйной камеры,,41,,PRINT
схема ресторана,планировка ресторана,,41,,PRINT
дизайн проект состав,дизайн проект,,41,,PRINT
металлоконструкция на заказ,производство металлоконструкций,,41,,PRINT
изготовление шестеренок на заказ,изготовление шестерен,,41,,PRINT
печать проектов и чертежей копировальня,печать проектной документации,,40,,PRINT
печать чертежей формат а1 копировальня,распечатка чертежей копировальня,,40,,PRINT
чертеж ру,чертежи ру,,40,,PRINT
миг-25 чертеж,миг-25 чертеж,,40,,PRINT
кто делает чертежи,профессия связанная с черчением,,40,,PRINT
м30 на чертеже что значит,как выглядит резьба,,40,,PRINT
кто делает чертежи профессия,профессия связанная с черчением,,40,,PRINT
комплексный чертеж состоит из,комплексный чертеж,,40,,PRINT
дачный туалет чертежи с размерами,дачный туалет чертежи с размерами,,40,,PRINT
чертежи дробеструйная камера,чертеж камеры дробеструйной,,40,,PRINT
тэн по чертежу,тэн на заказ,,40,,PRINT
отсканировать документ в москве,услуги сканирования документов,,40,,PRINT
резка металла по размерам заказчика,услуги лазерной резки,,40,,PRINT
баня с беседкой и мангальной зоной под одной крышей проекты фото,баня с мангальной зоной под одной крышей,,40,,PRINT
на разрезе заштриховывают,для чего на чертежах применяются разрезы,,40,,PRINT
печать чертежей в москве с копи,с копи,,39,,PRINT
печать чертежей с копи,печать чертежей в москве,,39,,PRINT
печать чертежей а0 с копи,печать чертежей,,39,,PRINT
стоимость печати чертежей копировальня,распечатка чертежей а0 копировальня,,39,,PRINT
