query,cluster,group,demand,comp,category
шаблоны для лазерной резки,макеты для лазерной резки,,25,,INFO
лучшие услуги по печати чертежей a1 в москве копировальня,печать чертежей в москве,,24,,BRANDED
wi-fi пушка чертежи,wifi пушка,,24,,BRANDED
на клетчатой бумаге с размером 1х1 изображена фигура найдите длину отрезка ав по данным чертежа огэ,на клетчатой бумаге с размером 1х1 изображена фигура найдите длину отрезка ав по данным чертежа,,24,,PRINT
что такое виды в черчении,виды на чертеже,,24,,INFO
производство обечаек,изготовление обечаек,,24,,PRINT
угловые шкафы чертежи с размерами фото,угловой шкаф купе в прихожую фото дизайн идеи со схемами,,24,,PRINT
чертеж на заказ,заказать чертеж онлайн,,24,,PRINT
кресло качалка из фанеры чертежи и размеры,кресло качалка своими руками,,23,,PRINT
схема и чертежи печи бани,печь для бани своими руками из металла чертежи,,23,,PRINT
лазерная резка деталей из металла,лазерная резка металла,,23,,PRINT
отсканированные чертежи,отсканировать чертежи,,22,,PRINT
чертежи факторио space age,чертежи факторио space age,,22,,BRANDED
вырезка лазером по металлу,лазерная резка металла москва,,22,,PRINT
планировка кафе с размерами,планировка кафе,,22,,PRINT
план расстановки торгового оборудования,расположение торгового оборудования в магазине,,22,,PRINT
sup доска чертежи,чертеж sup доски,,21,,BRANDED
качели на даче фото и чертежи,качели своими руками из дерева для дачи с чертежами,,21,,PRINT
чертеж вольера для собаки,вольер для собаки своими руками,,21,,PRINT
чертеж для модели икарус 280 из пластика,чертеж для модели икарус 280,,21,,PRINT
dune awakening уникальные чертежи,dune awakening уникальные чертежи,,21,,BRANDED
расчет крыши на дом калькулятор онлайн,калькулятор кровли,,21,,PRINT
копировальный центр стоимость,копия а4 стоимость,,21,,PRINT
лазер для разметки,лазер для разметки,,21,,PRINT
создать чертеж онлайн с размерами,чертеж онлайн,,21,,PRINT
начертить чертеж,чертеж онлайн,,21,,PRINT
офсетная печать чертежей а1 в москве копировальня,печать чертежей в москве,,20,,PRINT
чертеж геометрическое черчение 6 класс технология презентация,чертеж геометрическое черчение 6 класс технология презентация,,20,,PRINT
квадрат изображенный на чертеже разбит на 3 прямоугольника периметры которых указаны на чертеже,квадрат изображенный на чертеже разбит на 3 прямоугольника периметры которых указаны на чертеже,,20,,PRINT
тяжелый ксиранит чертеж,тяжелый ксиранит чертеж,,20,,PRINT
онлайн расчет лестницы на второй этаж,калькулятор лестницы,,20,,PRINT
печать чертежей а0 в москве с копи,срочная печать чертежей а2,,19,,PRINT
печать чертежей а2 в москве с копи,срочная печать чертежей а2,,19,,PRINT
профессиональная печать больших чертежей в москве копировальня,печать чертежей в москве,,19,,PRINT
изготовление чертежей,изготовление чертежей на заказ,,19,,PRINT
f-2-b чертеж,f-2-b чертеж,,19,,BRANDED
гетонитовый компонент чертеж,гетонитовый компонент чертеж,,19,,PRINT
каминная топка астов пт800 чертежи,каминная топка астов пт 800,,19,,PRINT
лазерная резка металла штучно,лазерная резка металла цена,,19,,PRINT
гост внесение изменений в рабочую документацию,гост р 21.101-2020,,19,,PRINT
типы линий в черчении,линии чертежа,,19,,PRINT
отсканировать чертеж а1 москва,сканирование чертежей а1,,18,,PRINT
сканирование широкоформатных чертежей,сканирование больших форматов москва,,18,,PRINT
помогите с чертежами,заказать чертеж онлайн,,18,,PRINT
отсканировать документ москва,услуги сканирования документов,,18,,PRINT
отсканировать чертеж,сканирование чертежей,,17,,PRINT
чертежи николы тесла,чертежи николы тесла,,17,,PRINT
чертежи для 3д принтера,3д модели,,17,,PRINT
печать чертежей в москве bigformat,печать чертежей а2 цена,,17,,BRANDED
тэны на заказ в москве,изготовление тэнов под заказ в москве,,17,,PRINT
проект ресторан,проектирование ресторана,,17,,PRINT
правила оформления рабочей документации,гост р 21.101-2020,,17,,PRINT
16,сканирование чертежей а1,,16,,PRINT
чертеж и масштаб для школьников,чертеж и масштаб для школьников,,16,,PRINT
чертеж гаража 6 на 4,чертёж гаража 6 на 4,,16,,PRINT
боголюбов 16 чертеж,боголюбов 16 чертеж,,16,,PRINT
калькулятор вальмовой крыши онлайн с чертежом,калькулятор вальмовой крыши,,16,,PRINT
коды на школу волка ведьмак 3,консольные команды ведьмака 3,,16,,PRINT
производство валов для станков,производство валов,,16,,PRINT
планировка бара,планировка бара,,16,,PRINT
схема машины,устройство автомобиля,,16,,PRINT
разбивочный план земельного участка,разбивочный план земельного участка,,15,,PRINT
факторио принтс,чертежи факторио,,15,,PRINT
фальцевая кровля dwg,узлы фальцевой кровли в dwg,,15,,BRANDED
проект план дома,проекты домов,,15,,PRINT
сканирование кальки,сканирование а0 цена,,15,,PRINT
ложементы из пенополиэтилена,ложементы из вспененного полиэтилена,,15,,PRINT
14,печать чертежей в москве,,14,,PRINT
печать чертежей а2 в москве print-stroy,печать чертежей в москве,,14,,BRANDED
печать чертежей а1 в москве print-stroy,печать чертежей в москве,,14,,BRANDED
дизайн проект пример,дизайн проект квартиры чертежи,,14,,PRINT
ескд спецификация гост,гост 2.106,,14,,PRINT
пример дизайн проекта квартиры,дизайн проект квартиры чертежи,,14,,PRINT
обозначения на электрических схемах розеток и выключателей,обозначение розеток и выключателей на чертежах,,14,,PRINT
captain of industry blueprints,captain of industry чертежи,,14,,BRANDED
изготовление анкерных групп,анкерная группа,,14,,PRINT
гост 2 307,гост 2.307,,14,,PRINT
обмеры помещений стоимость за кв м,замеры помещения стоимость,,14,,PRINT
лазерная разметка на производстве,разметка лазером,,13,,PRINT
изготовление латунных изделий на заказ,изделия из латуни на заказ,,13,,PRINT
гост упрощенное обозначение отверстий,упрощенное обозначение отверстий на чертежах гост,,13,,NONTARGET
гост простановка размеров,гост 2.307,,13,,PRINT
заказы автокад,заказать чертеж в автокаде,,13,,PRINT
планировка зала ресторана,планировка зала ресторана,,13,,PRINT
изготовление шкивов в москве,,,13,,PRINT
обозначения чертежей,как читать чертежи,,12,,PRINT
помогите пожалуйста с левым чертежом,вид слева на чертеже,,12,,PRINT
печать чертежей в москве bigformat-copy,стоимость печати чертежей,,12,,BRANDED
проект каркасного дома купить для самостоятельного строительства,проекты каркасных домов,,12,,PRINT
сайт для дизайна интерьера онлайн,планировка квартиры,,12,,NONTARGET
системы лазерной разметки,лазерная разметка,,12,,PRINT
изготовление траверсы,изготовление траверсы для подъема груза,,12,,PRINT
шероховатости гост,шероховатость гост,,12,,PRINT
гриль стол джентльмены,стол барбекю из джентльменов,,12,,PRINT
гайки размеры,гайка м8 размеры,,12,,PRINT
круглосуточная печать чертежей в москве копировальня,круглосуточная печать чертежей в москве копировальня,,11,,PRINT
онлайн заказ печати чертежа в москве копировальня,печать чертежа копировальня,,11,,PRINT
копирование больших форматов,копирование больших форматов,,11,,PRINT
срочная печать чертежей в москве копировальня,печать проектов и чертежей,,11,,PRINT
чертежи нижний новгород,чертежи нижний новгород,,11,,PRINT
готовые кадастровые чертежи,готовые кадастровые чертежи,,11,,PRINT
название детали для чертежа,как назвать деталь на чертеже,,11,,PRINT
урна для санузла нержавейка квадратная чертежи,есть ли регламент как вешать дозатор для мыла,,11,,PRINT
чертежные работы,заказать чертеж онлайн,,11,,PRINT
калькулятор вальмовой крыши онлайн,калькулятор вальмовой крыши,,11,,PRINT
экструзия алюминия на заказ,экструзия алюминия на заказ,,11,,PRINT
производство латунных изделий,изготовление из латуни,,11,,PRINT
что такое км и кмд металлоконструкций,кмд в строительстве,,11,,INFO
муфты на заказ,изготовление муфт,,11,,PRINT
типовые проекты частных домов,проекты домов,,11,,PRINT
стоимость архитектурных обмеров,обмерные работы цена,,11,,PRINT
изготовление фланцев на заказ в москве,изготовление фланцев,,11,,PRINT
изделия из резины на заказ,изготовление рти по чертежам,,11,,PRINT
s copy москва,с копи,,11,,BRANDED
печать больших чертежей в москве копировальня,печать чертежей в москве,,10,,PRINT
чертежи москва,печать чертежей а1 в москве с копи,,10,,PRINT
госучреждения чертежи,план общественного здания,,10,,PRINT
чертежные работы на заказ,услуги чертежника,,10,,PRINT
печать чертежей в москве printsreda.ru,печать чертежей в москве print-stroy,,10,,BRANDED
изготовление оснастки на заказ,изготовление оснастки,,10,,PRINT
изготовление траверс,изготовление траверсы для подъема груза,,10,,PRINT
монтаж туалетных кабинок,монтаж сантехнических перегородок,,10,,PRINT
производство шестерен,изготовление шестерен,,10,,PRINT
гост рд,гост р 21.101-2020,,10,,PRINT
изготовление валов и шестерней на заказ,изготовление шестерен на заказ в москве,,10,,PRINT
гайка по гост,гост 5915-70,,10,,PRINT
план магазина неродовль,план магазина неродовль,,10,,PRINT
печать чертежей в москве бигформат копи,печать больших чертежей,,9,,PRINT
9,печать чертежа копировальня,,9,,PRINT
гост оформления проектной документации,гост р 21.101-2020,,9,,PRINT
рассчитать лестницу на второй этаж онлайн калькулятор,калькулятор лестницы,,9,,PRINT
где найти улучшения школы кота ведьмак,доспехи школы кота,,9,,PRINT
производство шкивов,производство шкивов,,9,,PRINT
эскиз дома с размерами,схемы домов,,9,,PRINT
изготовление изделий из латуни,изделия из латуни на заказ,,9,,PRINT
что такое rz и ra шероховатость поверхности,шероховатость,,9,,BRANDED
онлайн калькулятор лестниц,калькулятор лестницы,,9,,PRINT
заказать металлические детали,изготовление деталей из металла,,9,,PRINT
изделия из фторопласта,изготовление деталей из фторопласта,,9,,PRINT
рамка черчение размеры,рамка для черчения,,9,,PRINT
гост 591570 гайка,гост 5915-70,,9,,PRINT
колеса крановые двухребордные,колесо крановое двухребордное к2р,,9,,PRINT
печать чертежей в москве 7 499 642 46 17,печать чертежей 7 499 642 46 17,,8,,PRINT
заказ печати чертежей в москве копировальня,печать чертежей в москве,,8,,PRINT
где заказать срочную печать чертежей в москве копировальня,печать проектов и чертежей,,8,,PRINT
8,сканирование больших форматов москва,,8,,PRINT
сатисфактори схемы заводов,satisfactory схемы,,8,,PRINT
что означает надпись 3 х 45,что означает надпись 3 х 45,,8,,NONTARGET
гост каркас проекты домов,госткаркас.ру,,8,,PRINT
какие из точек принадлежат прямой,какие из точек принадлежат прямой x=1+t,,8,,PRINT
гост рамки,гост 2.104,,8,,PRINT
изготовление фланцев под заказ,изготовление фланцев,,8,,PRINT
цифровая печать чертежей a1 в москве копировальня,печать а1 цена,,7,,BRANDED
7,печать чертежей в москве,,7,,PRINT
чтобы заказать изделие на станке чпу нужно,чтобы заказать изделие на чпу нужно,,7,,PRINT
рамка по черчению размеры,рамка для черчения,,7,,PRINT
что такое ет 53 на дисках,ет,,7,,INFO
изготовление фланцев москва,изготовление фланцев,,7,,PRINT
рассчитать площадь кровли калькулятор онлайн,калькулятор кровли,,7,,PRINT
что такое литера в технической документации,литера о1 в конструкторской документации,,7,,INFO
гост 211101,гост р 21.101-2020,,7,,PRINT
зубикс металлообработка сайт,зубикс,,7,,NONTARGET
формат типография,типография формат,,7,,PRINT
проведал 400 каталог,проведал 400 каталог,,7,,PRINT
инженерная печать чертежей в москве бигформат копи,инженерная печать москва,,6,,PRINT
цифровая печать чертежей в москве копировальня,печать чертежа копировальня,,6,,PRINT
6,печать проектной документации москва,,6,,PRINT
печать чертежей в москве printside,printside,,6,,BRANDED
печать чертежей а2 в москве bigformat,печать чертежей в москве,,6,,BRANDED
схема встроенного шкафа купе с размерами,встроенный шкаф своими руками,,6,,PRINT
схема двускатной крыши,стропильная система двухскатной крыши,,6,,PRINT
центровые линии правильно,центровые линии окружности изображаются линией,,6,,PRINT
улучшения школы кота 1 ведьмак 3,доспехи школы кота,,6,,PRINT
штуцер на заказ,изготовление штуцеров,,6,,PRINT
metal gm,metal gm,,6,,BRANDED
спецификация содержит информацию о взаимодействии деталей,спецификация чертежа,,6,,PRINT
услуги фальцовки,фальцовка чертежей цена,,6,,PRINT
шероховатость ескд,гост 2.309,,6,,PRINT
обозначение розетки и выключателя,обозначение розеток и выключателей на чертежах,,6,,NONTARGET
спецификация это в черчении,спецификация чертежа,,6,,PRINT
ящики деревянные на заказ,изготовление деревянных ящиков,,6,,PRINT
гост на ролики конвейерные,ролики конвейерные гост,,6,,PRINT
проведал каталог профилей,каталог системы проведал,,6,,PRINT
блок фундаментных болтов,блок фундаментных болтов,,6,,PRINT
цветная печать чертежей а0 в москве,печать чертежей а1,,5,,PRINT
печать чертежей а1 в москве бигформат копи,печать чертежей а0 в москве,,5,,PRINT
5,печать инженерных чертежей,,5,,PRINT
печать чертежей в москве eph1,копирование и печать чертежей,,5,,BRANDED
печать чертежей в москве print24,принт24,,5,,BRANDED
онлайн калькулятор вальмовой крыши,калькулятор вальмовой крыши,,5,,PRINT
инженерная графика помощь,помогите с инженерной графикой пожалуйста,,5,,PRINT
геодезические разбивочные работы в строительстве,сп 126.13330.2017,,5,,PRINT
построить дом майнкрафт по схеме,дом в майнкрафте схема,,5,,PRINT
ту 160 википедия,ту 160,,5,,PRINT
схема установки откатных ворот 4 м,откатные ворота 4 метра чертеж,,5,,PRINT
расчет вальмовой крыши онлайн,калькулятор вальмовой крыши,,5,,PRINT
крупногабаритная мехобработка,крупногабаритная металлообработка,,5,,PRINT
схема лестницы на второй этаж,лестница своими руками,,5,,PRINT
чпу производство,бизнес станков,,5,,PRINT
самолет пчелка ан 14,ан 14,,5,,PRINT
гост обозначение резьбы,гост 16093,,5,,NONTARGET
изготовление деталей любой сложности,изготовление деталей на заказ,,5,,PRINT
рамка ескд,гост 2.104,,5,,PRINT
схема магазина,планировка магазина продуктов,,5,,PRINT
цветная печать чертежей в москве,печать чертежей в москве,,4,,PRINT
печать чертежей а4 в москве,печать чертежей недорого,,4,,PRINT
цветная печать чертежей а3 в москве,печать чертежей а2 цена,,4,,PRINT
цветная печать чертежей а1 в москве,печать чертежей в москве,,4,,PRINT
4,сканирование чертежей москва,,4,,PRINT
печать чертежей а2 в москве bigformat-copy,печать чертежей а1 в москве,,4,,BRANDED
инженерная печать чертежей в москве print-stroy,экспресс-печать инженерных чертежей в москве,,4,,BRANDED
печать чертежей а1 в москве bigformat-copy,печать чертежей а0,,4,,BRANDED
печать чертежей а2 в москве eph1,срочная печать чертежей в москве,,4,,BRANDED
печать чертежей а0 в москве на фолиопринт ру,стоимость печати чертежей,,4,,PRINT
печать чертежей а1 в москве s copy,печать чертежей в москве,,4,,BRANDED
печать чертежей в москве bigformat copy,печать чертежей,,4,,BRANDED
печать чертежей а0 в москве eph1,печать чертежей дешево с копи,,4,,BRANDED
инженерная печать чертежей в москве bigformat,печать инженерных чертежей,,4,,BRANDED
схемы satisfactory производства,satisfactory схемы,,4,,BRANDED
фальц полиграфия,фальцовка,,4,,PRINT
factorioprints,чертежи факторио,,4,,BRANDED
план одноэтажного дома с размерами,проекты одноэтажных домов,,4,,PRINT
печать мгсу,печать мгсу,,4,,PRINT
blueprints factorio,чертежи факторио,,4,,BRANDED
геометрическое черчение 6 класс технология,чертеж геометрическое черчение 6 класс технология презентация,,4,,PRINT
самодельный блочный лук,блочный лук своими руками,,4,,PRINT
серегин начертательная геометрия,начертательная геометрия жирных,,4,,PRINT
профиль алюминиевый под заказ,алюминиевый профиль на заказ,,4,,PRINT
печать на кальке цена,печать на кальке,,4,,PRINT
технические требования ескд,гост 2.316,,4,,PRINT
выкройка коробки,развертка коробки,,4,,PRINT
черчение на заказ,заказать чертеж онлайн,,4,,PRINT
калька с логотипом на заказ,калька с логотипом,,4,,PRINT
